author,content,poem name,age,type
john donne,come  madam  come  all rest my powers defy until i labour  i in labour lie the foe oft times having the foe in sight is tird with standing though he never fight off with that girdle  like heavens zone glistering but a far fairer world encompassing unpin that spangled breastplate which you wear that theyes of busy fools may be stopped there unlace yourself  for that harmonious chime tells me from you  that now it is bed time off with that happy busk  which i envy that still can be  and still can stand so nigh your gown going off  such beauteous state reveals as when from flowery meads thhills shadow steals off with that wiry coronet and shewthe hairy diadem which on you doth grow now off with those shoes  and then safely treadin this loves hallowd temple  this soft bed in such white robes  heavens angels used to bereceived by men  thou angel bringst with theea heaven like mahomets paradise  and thoughill spirits walk in white  we easily know by this these angels from an evil sprite those set our hairs  but these our flesh upright licence my roving hands  and let them go before  behind  between  above  below o my america  my new found land my kingdom  safeliest when with one man mannd my mine of precious stones  my empirie how blest am i in this discovering thee to enter in these bonds  is to be free then where my hand is set  my seal shall be full nakedness  all joys are due to thee as souls unbodied  bodies unclothd must be to taste whole joys  gems which you women useare like atlantas balls  cast in mens views that when a fools eye lighteth on a gem his earthly soul may covet theirs  not them like pictures  or like books gay coverings madefor lay men  are all women thus arrayd themselves are mystic books  which only we whom their imputed grace will dignify must see reveald  then since that i may know as liberally  as to a midwife  shewthy self  cast all  yea  this white linen hence there is no penance due to innocence to teach thee  i am naked first  why thenwhat needst thou have more covering than a man ,To His Mistress Going to Bed,Renaissance,Love
john skelton,merry margaret as midsummer flower gentle as a falconor hawk of the tower with solace and gladness much mirth and no madness all good and no badness so joyously so maidenly so womanlyher demeaningin every thing far  far passingthat i can indite or suffice to writeof merry margaretas midsummer flower gentle as falconor hawk of the tower as patient and stilland as full of good willas fair isaphill coriander sweet pomander good cassander steadfast of thought well made  well wrought far may be soughtere that ye can findso courteous  so kindas merry margaret this midsummer flower gentle as falconor hawk of the tower ,To Mistress Margaret Hussey,Renaissance,Love
en jonson,that neither fame nor love might wanting beto greatness  cary  i sing that and thee whose house  if it no other honor had in only thee might be both great and glad who  to upbraid the sloth of this our time durst valor make almost  but not  a crime which deed i know not  whether were more high or thou more happy  it to justifyagainst thy fortune  when no foe  that day could conquer thee but chance  who did betray love thy great loss  which a renown hath won to live when broick not stands  nor ruhr doth run love honors  which of best example bewhen they cost dearest and are done most free though every fortitude deserves applause it may be much or little in the cause hes valiantst that dares fight  and not for pay that virtuous is  when the rewards away ,To Sir Henry Cary,Renaissance,Love
sir walter ralegh,methought i saw the grave where laura lay within that temple where the vestal flamewas wont to burn  and  passing by that way to see that buried dust of living fame whose tomb fair love  and fairer virtue kept all suddenly i saw the fairy queen at whose approach the soul of petrarch wept and  from thenceforth  those graces were not seen for they this queen attended  in whose steadoblivion laid him down on lauras hearse hereat the hardest stones were seen to bleed and groans of buried ghosts the heavens did pierce where homers spright did tremble all for grief and cursed the access of that celestial thief ,A Vision upon the Fairy Queen,Renaissance,Love
thomas campion,when thou must home to shades of underground and there arrived  a new admired guest the beauteous spirits do engirt thee round white iope  blithe helen  and the rest to hear the stories of thy finished lovefrom that smooth tongue whose music hell can move then wilt thou speak of banqueting delights of masques and revels which sweet youth did make of tourneys and great challenges of knights and all these triumphs for thy beautys sake when thou hast told these honours done to thee then tell  o tell  how thou didst murder me ,Vobiscum Est Iope,Renaissance,Love
sir walter ralegh,as you came from the holy landof walsinghamemet you not with my true loveby the way as you came how shall i know your true lovethat have met many oneas i went to the holy landthat have come  that have gone she is neither white nor brownbut as the heavens fairthere is none hath a form so divinein the earth or the air such an one did i meet  good sir such an angelic face who like a queen  like a nymph  did appearby her gait  by her grace she hath left me here all alone all alone as unknown who sometimes did me lead with her self and me loved as her own whats the cause that she leaves you aloneand a new way doth take who loved you once as her ownand her joy did you make i have loved her all my youth but now old  as you see love likes not the falling fruitfrom the withered tree know that love is a careless childand forgets promise past he is blind  he is deaf when he listand in faith never fast his desire is a dureless contentand a trustless joyhe is won with a world of despairand is lost with a toy of womenkind such indeed is the loveor the word love abusedunder which many childish desiresand conceits are excused but true love is a durable firein the mind ever burning never sick  never old  never dead from itself never turning ,Walsinghame,Renaissance,Love
sir philip sidney,what length of verse can serve brave mopsas good to show whose virtues strange  and beauties such  as no man them may know thus shrewdly burden  then  how can my muse escape the gods must help  and precious things must serve to show her shape like great god saturn  fair  and like fair venus  chaste as smooth as pan  as juno mild  like goddess iris fast with cupid she foresees  and goes god vulcans pace and for a taste of all these gifts  she borrows momus grace her forehead jacinth like  her cheeks of opal hue her twinkling eyes bedecked with pearl  her lips of sapphire blue her hair pure crapall stone  her mouth  o heavenly wide her skin like burnished gold  her hands like silver ore untried as for those parts unknown  which hidden sure are best happy be they which believe  and never seek the rest ,What Length of Verse?,Renaissance,Love
thomas campion,when to her lute corinna sings her voice revives the leaden strings and doth in highest notes appearas any challenged echo clear but when she doth of mourning speak evn with her sighs the strings do break and as her lute doth live or die let by her passion  so must i for when of pleasure she doth sing my thoughts enjoy a sudden spring but if she doth of sorrow speak evn from my heart the strings do break ,When to Her Lute Corinna Sings,Renaissance,Love
john donne,now thou has loved me one whole day tomorrow when you leavst  what wilt thou say wilt thou then antedate some new made vow or say that nowwe are not just those persons which we were or  that oaths made in reverential fearof love  and his wrath  any may forswear or  as true deaths true marriages untie so lovers contracts  images of those bind but till sleep  deaths image  them unloose or  your own end to justify for having purposed change and falsehood  youcan have no way but falsehood to be true vain lunatic  against these scapes i coulddispute and conquer  if i would which i abstain to do for by tomorrow  i may think so too ,Woman's Constancy,Renaissance,Love
john skelton,womanhood  wanton  ye want your meddling  mistress  is mannerless plenty of ill  of goodness scant ye rail at riot  reckless to praise your port it is needless for all your draff yet and your dregs as well borne as ye full oft time begs why so coy and full of scorn mine horse is sold  i ween  you say my new furred gown  when it is worn   put up your purse  ye shall not pay by crede  i trust to see the day as proud a pea hen as ye spread of me and other ye may have need though angelic be your smiling yet is your tongue an adders tail full like a scorpion stingingall those by whom ye have avail good mistress anne  there ye do shail what prate ye  pretty pigesnye i trust to quite you ere i die your key is meet for every lock your key is common and hangeth out your key is ready  we need not knock nor stand long wresting there about of your door gate ye have no doubt but one thing is  that ye be lewd hold your tongue now  all beshrewd to mistress anne  that farly sweet that wones at the key in thames street  ,"Womanhood, wanton, ye want",Renaissance,Love
henry howard  earl of surrey,wyatt resteth here  that quick could never rest whose heavenly gifts increased by disdain and virtue sank the deeper in his breast such profit he of envy could obtain a head  where wisdom mysteries did frame whose hammers beat still in that lively brainas on a stith  where some work of famewas daily wrought  to turn to britains gain a visage  stern and mild  where both did grow vice to condemn  in virtues to rejoice amid great storms whom grace assured so to live upright and smile at fortunes choice a hand that taught what might be said in rhyme that reft chaucer the glory of his wit a mark the which  unperfited  for time some may approach  but never none shall hit a tongue that served in foreign realms his king whose courteous talk to virtue did enflameeach noble heart  a worthy guide to bringour english youth  by travail unto fame an eye whose judgment no affect could blind friends to allure  and foes to reconcile whose piercing look did represent a mindwith virtue fraught  reposed  void of guile a heart where dread yet never so impressedto hide the thought that might the truth avaunce in neither fortune lift  nor so repressed to swell in wealth  nor yield unto mischance a valiant corps  where force and beauty met happy  alas  too happy  but for foes lived  and ran the race that nature set of manhoods shape  where she the mold did lose but to the heavens that simple soul is fled which left with such  as covet christ to knowwitness of faith that never shall be dead sent for our health  but not received so thus  for our guilt  this jewel have we lost the earth his bones  the heavens possess his ghost amen ,Wyatt Resteth Here,Renaissance,Love
sir thomas wyatt,alas  madam  for stealing of a kisshave i so much your mind there offended have i then done so grievously amissthat by no means it may be amended then revenge you  and the next way is this another kiss shall have my life ended for to my mouth the first my heart did suck the next shall clean out of my breast it pluck ,Alas Madam for Stealing of a Kiss,Renaissance,Love
edmund spenser,the sovereign beauty which i do admire witness the world how worthy to be praised the light whereof hath kindled heavenly firein my frail spirit  by her from baseness raised that being now with her huge brightness dazed base thing i can no more endure to view but looking still on her  i stand amazedat wondrous sight of so celestial hue so when my tongue would speak her praises due it stopped is with thoughts astonishment and when my pen would write her titles true it ravishd is with fancys wonderment yet in my heart i then both speak and writethe wonder that my wit cannot endite ,Amoretti III: The Sovereign Beauty,Renaissance,Love
edmund spenser,like as a huntsman after weary chase seeing the game from him escapd away sits down to rest him in some shady place with panting hounds beguiled of their prey so after long pursuit and vain assay when i all weary had the chase forsook the gentle deer returnd the self same way thinking to quench her thirst at the next brook there she beholding me with milder look sought not to fly  but fearless still did bide till i in hand her yet half trembling took and with her own goodwill her firmly tied strange thing  me seemd  to see a beast so wild so goodly won  with her own will beguild ,Amoretti LXVII: Like as a Huntsman,Renaissance,Love
edmund spenser,most happy letters  framd by skilful trade with which that happy name was first designd the which three times thrice happy hath me made with gifts of body  fortune  and of mind the first my being to me gave by kind from mothers womb derivd by due descent the second is my sovereign queen most kind that honour and large richesse to me lent the third my love  my lifes last ornament by whom my spirit out of dust was raised to speak her praise and glory excellent of all alive most worthy to be praised ye three elizabeths for ever live that three such graces did unto me give ,Amoretti LXXIV: Most Happy Letters,Renaissance,Love
edmund spenser,men call you fair  and you do credit it for that your self ye daily such do see but the true fair  that is the gentle wit and vertuous mind  is much more praisd of me for all the rest  how ever fair it be shall turn to naught and lose that glorious hue but only that is permanent and freefrom frail corruption  that doth flesh ensue that is true beauty  that doth argue youto be divine  and born of heavenly seed derivd from that fair spirit  from whom all trueand perfect beauty did at first proceed he only fair  and what he fair hath made all other fair  like flowers untimely fade ,Amoretti LXXIX: Men Call you Fair,Renaissance,Love
edmund spenser,one day i wrote her name upon the strand but came the waves and washed it away again i wrote it with a second hand but came the tide  and made my pains his prey  vain man   said she   that dost in vain assay a mortal thing so to immortalize for i myself shall like to this decay and eke my name be wiped out likewise   not so    quod i   let baser things deviseto die in dust  but you shall live by fame my verse your vertues rare shall eternize and in the heavens write your glorious name where whenas death shall all the world subdue our love shall live  and later life renew  ,Amoretti LXXV: One Day I Wrote her Name,Renaissance,Love
edmund spenser,this holy season  fit to fast and pray men to devotion ought to be inclind therefore i likewise on so holy day for my sweet saint some service fit will find her temple fair is built within my mind in which her glorious image placed is on which my thoughts do day and night attend like sacred priests that never think amiss there i to her as th author of my bliss will build an altar to appease her ire and on the same my heart will sacrifice burning in flames of pure and chaste desire the which vouchsafe  o goddess  to accept amongst thy dearest relics to be kept ,Amoretti XXII: This Holy Season,Renaissance,Love
