author,content,poem name,age,type
william shakespeare,let the bird of loudest layon the sole arabian treeherald sad and trumpet be to whose sound chaste wings obey but thou shrieking harbinger foul precurrer of the fiend augur of the fevers end to this troop come thou not near from this session interdictevery fowl of tyrant wing save the eagle  featherd king keep the obsequy so strict let the priest in surplice white that defunctive music can be the death divining swan lest the requiem lack his right and thou treble dated crow that thy sable gender makstwith the breath thou givst and takst mongst our mourners shalt thou go here the anthem doth commence love and constancy is dead phoenix and the turtle fledin a mutual flame from hence so they lovd  as love in twainhad the essence but in one two distincts  division none number there in love was slain hearts remote  yet not asunder distance and no space was seentwixt this turtle and his queen but in them it were a wonder so between them love did shinethat the turtle saw his rightflaming in the phoenix sight either was the others mine property was thus appalledthat the self was not the same single natures double nameneither two nor one was called reason  in itself confounded saw division grow together to themselves yet either neither simple were so well compounded that it cried   how true a twainseemeth this concordant one love has reason  reason none if what parts can so remain  whereupon it made this threneto the phoenix and the dove co supremes and stars of love as chorus to their tragic scene  threnosbeauty  truth  and rarity grace in all simplicity here enclosd  in cinders lie death is now the phoenix nest and the turtles loyal breastto eternity doth rest leaving no posterity twas not their infirmity it was married chastity truth may seem but cannot be beauty brag but tis not she truth and beauty buried be to this urn let those repairthat are either true or fair for these dead birds sigh a prayer ,The Phoenix and the Turtle,Renaissance,Mythology & Folklore
duchess of newcastle margaret cavendish,sir charles into my chamber coming in when i was writing of my fairy queen i praysaid hewhen queen mab you do seepresent my service to her majesty and tell her i have heard fames loud reportboth of her beauty and her stately court when i queen mab within my fancy viewed my thoughts bowed low  fearing i should be rude kissing her garment thin which fancy made i knelt upon a thought  like one that prayed and then  in whispers soft  i did presenthis humble service which in mirth was sent thus by imagination i have beenin fairy court and seen the fairy queen ,An Epilogue to the Above,Renaissance,Mythology & Folklore
thomas bastard,our vice runs beyond all that old men saw and far authentically above our laws and scorning virtues safe and golden mean sits uncontrolled upon the high extreme circes  thy monsters painted out the hue of feigned filthiness  but ours is true our vice puts down all proverbs and all themes our vice excels all fables and all dreams ,"Book 7, Epigram 42",Renaissance,Mythology & Folklore
