author,content,poem name,age,type
hart crane,ithe mind has shown itself at timestoo much the baked and labeled doughdivided by accepted multitudes across the stacked partitions of the dayacross the memoranda  baseball scores the stenographic smiles and stock quotationssmutty wings flash out equivocations the mind is brushed by sparrow wings numbers  rebuffed by asphalt  crowdthe margins of the day  accent the curbs convoying divers dawns on every cornerto druggist  barber and tobacconist until the graduate opacities of eveningtake them away as suddenly to somewherevirginal perhaps  less fragmentary  cool  there is the world dimensional for those untwisted by the love of things irreconcilable    and yet  suppose some evening i forgotthe fare and transfer  yet got by that waywithout recall lost yet poised in traffic then i might find your eyes across an aisle still flickering with those prefigurationsprodigal  yet uncontested now half riant before the jerky window frame there is some way  i think  to touchthose hands of yours that count the nightsstippled with pink and green advertisements and now  before its arteries turn darki would have you meet this bartered blood imminent in his dream  none better knowsthe white wafer cheek of love  or offers wordslightly as moonlight on the eaves meets snow reflective conversion of all thingsat your deep blush  when ecstasies threadthe limbs and belly  when rainbows spreadimpinging on the throat and sides     inevitable  the body of the worldweeps in inventive dust for the hiatusthat winks above it  bluet in your breasts the earth may glide diaphanous to death but if i lift my arms it is to bendto you who turned away once  helen  knowingthe press of troubled hands  too alternatewith steel and soil to hold you endlessly i meet you  therefore  in that eventual flameyou found in final chains  no captive thenbeyond their million brittle  bloodshot eyes white  through white cities passed on to assumethat world which comes to each of us alone accept a lone eye riveted to your plane bent axle of devotion along companion waysthat beat  continuous  to hourless daysone inconspicuous  glowing orb of praise  iibrazen hypnotics glitter here glee shifts from foot to foot magnetic to their tremulo this crashing opera bouffe blest excursion  this ricochetfrom roof to roofknow  olympians  we are breathlesswhile nigger cupids scour the stars a thousand light shrugs balance usthrough snarling hails of melody white shadows slip across the floorsplayed like cards from a loose hand rhythmic ellipses lead into cantersuntil somewhere a rooster banters greet naivelyyet intrepidlynew soothings  new amazementsthat cornets introduce at every turnand you may fall downstairs with mewith perfect grace and equanimity or  plaintively scud past shoreswhere  by strange harmonic lawsall relatives  serene and cool sit rocked in patent armchairs o i have known metallic paradiseswhere cuckoos clucked to finchesabove the deft catastrophes of drums while titters hailed the groans of deathbeneath gyrating awnings i have seenthe incunabula of the divine grotesque this music has a reassuring way the siren of the springs of guilty songlet us take her on the incandescent waxstriated with nuances  nervositiesthat we are heir to  she is still so young we cannot frown upon her as she smiles dipping here in this cultivated stormamong slim skaters of the gardened skies  iiicapped arbiter of beauty in this streetthat narrows darkly into motor dawn you  here beside me  delicate ambassadorof intricate slain numbers that arisein whispers  naked of steel  religious gunman who faithfully  yourself  will fall too soon and in other ways than as the wind settleson the sixteen thrifty bridges of the city let us unbind our throats of fear and pity  we even who drove speediest destructionin corymbulous formations of mechanics who hurried the hill breezes  spouting maliceplangent over meadows  and looked downon rifts of torn and empty houseslike old women with teeth unjubilantthat waited faintly  briefly and in vain we know  eternal gunman  our flesh remembersthe tensile boughs  the nimble blue plateaus the mounted  yielding cities of the air that saddled sky that shook down verticalrepeated play of fireno hypogeumof wave or rock was good against one hour we did not ask for that  but have survived and will persist to speak again beforeall stubble streets that have not curvedto memory  or known the ominous lifted armthat lowers down the arc of helens browto saturate with blessing and dismay a goose  tobacco and colognethree winged and gold shod prophecies of heaven the lavish heart shall always have to leavenand spread with bells and voices  and atonethe abating shadows of our conscript dust anchises navel  dripping of the sea the hands erasmus dipped in gleaming tides gathered the voltage of blown blood and vine delve upward for the new and scattered wine o brother thief of time  that we recall laugh out the meager penance of their dayswho dare not share with us the breath released the substance drilled and spent beyond repairfor golden  or the shadow of gold hair distinctly praise the years  whose volatileblamed bleeding hands extend and thresh the heightthe imagination spans beyond despair outpacing bargain  vocable and prayer ,For The Marriage of Faustus and Helen,Modern,Mythology & Folklore
hugh macdiarmid,hugh macdiarmid  gairmscoile from selected poetry  copyright1992 by alan riach and michael grieve  reprinted with the permission of new directions publishing corporation ,Gairmscoile,Modern,Mythology & Folklore
e  e  cummings,in just springwhen the world is mud luscious the littlelame balloonmanwhistlesfarand weeand eddieandbill comerunning from marbles andpiracies and itsspringwhen the world is puddle wonderfulthe queerold balloonman whistlesfarand weeand bettyandisbel come dancingfrom hop scotch and jump rope anditsspringand thegoat footedballoonmanwhistlesfarandwee,[in Just-],Modern,Mythology & Folklore
louis untermeyer,we passed old farmer boothby in the field rugged and straight he stood  his body steeledwith stubbornness and age  we met his eyesthat never flinched or turned to compromise and luck  he cried  good luck and waved an arm knotted and sailor like  such as no farmin all of maine could boast of  and awayhe turned again to pitch his new cut hay   we walked on leisurely until a bendshowed him once more  now working toward the endof one great path  wearing his eighty yearslike banners lifted in a wind of cheers then we turned off abruptlytook the roadcutting the village  the one with the commandingview of the river  and we strodemore briskly now to the long pier that showedwhere the frail boats were kept at indian landing in the canoe we stepped  our paddles dippedleisurely downwards  and the slim bark slippedmore on than in the water  smoothly thenwe shot its nose against the rippling current feeling the rising rivers half deterrentpull on the paddle as we turned the bladeto keep from swerving round  while we delayedto watch the curious wave eaten locks or pass  with lazy turns  the picnic rocks    blue eels flew under us  and fishes darteda thousand ways  the once broad channel shrunk and over us the wise and noble heartedtwilight leaned down  the sunset mists were parted and we  with thoughts on tiptoe  slunkdown the green  twisting alleys of the kennebunk motionless in the meadowsthe trees  the rocks  the cows   and quiet dripped from the shadowslike rain from heavy boughs the tree toads started ringingtheir ceaseless silver bells a land locked breeze came swingingits censer of earthy smells the rivers tiny canonstretched into dusky lands like a dark and silent companionevening held out her hands hushed were the dawns bravados loud noon was a silenced cryand quiet slipped from the shadowsas stars slip out of the sky   it must have been an hour more  or later when  tramping homeward through the piney wood we felt the years fly back  the brotherhoodof forests took usand we saw the satyr there in a pool  up to his neck  he stoodand grinned to see us stare  increduloustoo startled to remember fear or flight feeling the menace in the crafty night we turned to runwhen lo  he called to us using our very names he called  we drewwith creaking courage down the avenueof birches till we saw  with clearing sight  no longer through a tricky  pale green light familiar turns and shrubs  the friendly path and farmer boothby in his woodland bath the woods became his background  every treeseemed part of him  and stood erect  and sharedthe beauty of that gnarled serenity the quiet vigor of age that smiled and squaredits shoulders against time     and even nightflowed in and out of him  as though contentwith such a native element happy to move about a spirit quiteas old  as placid and as confident   sideways we turned  still glistening and uncladhe leaped up on the bank  light as a lad his body in the moonlight dripping stars   we went on homeward  through the pasture bars ,Magic,Modern,Mythology & Folklore
wallace stevens,wallace stevens  a rabbit as the king of ghosts from collected poems  copyright 1954 by wallace stevens and copyright renewed 1982 by holly stevens  used by permission of alfred a  knopf  an imprint of the knopf doubleday publishing group  a division of penguin random house llc  all rights reserved ,A Rabbit as King of the Ghosts,Modern,Mythology & Folklore
marjorie pickthall,living  i had no mightto make you hear now  in the inmost night i am so nearno whisper  falling light divides us  dear living  i had no claimon your great hours now the thin candle flame the closing flowers wed summer with my name  and these are ours your shadow on the dust strength  and a cry delight  despair  mistrust  all these am i dawn  and the far hills thrustto a far sky living  i had no skillto stay your tread now all that was my willsilence has said we are one for good and illsince i am dead ,The Wife,Modern,Mythology & Folklore
carl sandburg,momus is the name men give your face the brag of its tone  like a long low steamboat whistlefinding a way mid mist on a shoreland where gray rocks let the salt water shatter spray against horizons purple  silent yes  momus men have flung your face in bronzeto gaze in gargoyle downward on a street whirl of folk they were artists did this  shaped your sad mouth gave you a tall forehead slanted with calm  broad wisdom all your lips to the corners and your cheeks to the high bonesthrown over and through with a smile that forever wishes and wishes  purple  silent  fled from all the iron things of life  evaded like a sought bandit  gone into dreams  by god i wonder  momus whether shadows of the dead sit somewhere and look with deep laughteron men who play in terrible earnest the old  known  solemn repetitions of history a droning monotone soft as sea laughter hovers from your kindliness of bronze you give me the human ease of a mountain peak  purple  silent granite shoulders heaving above the earth curves careless eye witness of the spawning tides of men and womenswarming always in a drift of millions to the dust of toil  the salt of tears and blood drops of undiminishing war ,Momus,Modern,Mythology & Folklore
richard aldington,potuia  potuiawhite grave goddess pity my sadness o silence of paros i am not of these about thy feet these garments and decorum i am thy brother thy lover of aforetime crying to thee and thou hearest me not i have whispered thee in thy solitudesof our loves in phrygia the far ecstasy of burning noonswhen the fragile pipesceased in the cypress shade and the brown fingers of the shepherdmoved over slim shoulders and only the cicada sang i have told thee of the hillsand the lisp of reedsand the sun upon thy breasts and thou hearest me not potuia  potuiathou hearest me not ,To a Greek Marble,Modern,Mythology & Folklore
richard aldington,the ancient songspass deathward mournfully cold lips that sing no more  and withered wreaths regretful eyes  and drooping breasts and wingssymbols of ancient songsmournfully passingdown to the great white surges watched of none    save the frail sea birdsand the lithe pale girls daughters of okeanos and the songs passfrom the green landwhich lies upon the waves as a leafon the flowers of hyacinth and they pass from the waters the manifold winds and the dim moon and they come silently winging through soft kimmerian dusk to the quiet level landsthat she keeps for us all that she wrought for us all for sleepin the silver days of the earths dawningproserpine  daughter of zeus and we turn from the kuprians breasts and we turn from thee phoibos apollon and we turn from the music of oldand the hills that we loved and the meads and we turn from the fiery day and the lips that were over sweet for silentlybrushing the fields with red shod feet with purple robesearing the flowers as with a sudden flame death thou hast come upon us and of all the ancient songspassing to the swallow blue hallsby the dark streams of persephone this only remains that in the end we turn to thee death that we turn to thee  singingone last song o death thou art an healing windthat blowest over white flowersa tremble with dew thou art a wind flowingover long leagues of lonely sea thou art the dusk and the fragrance thou art the lips of love mournfully smiling thou art the pale peace of onesatiate with old desires thou art the silence of beauty and we look no more for the morning we yearn no more for the sun since with thy white hands death thou crownest us with the pallid chaplets the slim colorless poppieswhich in thy garden alonesoftly thou gatherest and silently and with slow feet approaching and with bowed head and unlit eyes we kneel before thee and thou  leaning towards us  caressingly layest upon usflowers from thy thin cold hands and  smiling as a chaste woman knowing love in her heart thou sealest our eyesand the illimitable quietudecomes gently upon us ,,Modern,Mythology & Folklore
guillaume apollinaire,knock knock he has closed his doorthe gardens lilies have started to rotso who is the corpse being carried from the houseyou just knocked on his doorand trot trottrot goes little lady mousetranslated from the french ,The Lady,Modern,Nature
guillaume apollinaire,i have built a house in the middle of the oceanits windows are the rivers flowing from my eyesoctopi are crawling all over where the walls arehear their triple hearts beat and their beaks peck against the windowpaneshouse of dampnesshouse of burningseasons fastnessseason singingthe airplanes are laying eggswatch out for the dropping of the anchorwatch out for the shooting black ichorit would be good if you were to come from the skythe skys honeysuckle is climbingthe earthly octopi are throbbingand so very many of us have become our own gravediggerspale octopi of the chalky waves o octopi with pale beaksaround the house is this ocean that you know welland is never stilltranslated from the french ,Ocean of Earth,Modern,Nature
wallace stevens,wallace stevens   of mere being  from the palm at the end of the mind  selected poems and a play  copyright1967  1969  1971 by holly stevens used by permission of alfred a  knopf  an imprint of the knopf doubleday publishing group  a division of random house llc  all rights reserved ,Of Mere Being,Modern,Nature
william butler yeats,w  b  yeats  a dialogue of self and soul from the poems of w  b  yeats  a new edition  edited by richard j  finneran  copyright 1933 by macmillan publishing company  renewed1961 by georgie yeats  reprinted with the permission of a  p  watt  ltd  on behalf of michael yeats ,A Dialogue of Self and Soul,Modern,Nature
william butler yeats,w  b  yeats  byzantium from the poems of w  b  yeats  a new edition  edited by richard j  finneran  copyright 1933 by macmillan publishing company  renewed1961 by georgie yeats  reprinted with the permission of a  p  watt  ltd  on behalf of michael yeats ,Byzantium,Modern,Nature
william butler yeats,o sweet everlasting voices  be still go to the guards of the heavenly foldand bid them wander obeying your will flame under flame  till time be no more have you not heard that our hearts are old that you call in birds  in wind on the hill in shaken boughs  in tide on the shore o sweet everlasting voices  be still ,The Everlasting Voices,Modern,Nature
william butler yeats,although you hide in the ebb and flowof the pale tide when the moon has set the people of coming days will knowabout the casting out of my net and how you have leaped times out of mindover the little silver cords and think that you were hard and unkind and blame you with many bitter words ,The Fish,Modern,Nature
william butler yeats,she that but little patience knew from childhood on  had now so mucha grey gull lost its fear and flewdown to her cell and there alit and there endured her fingers touchand from her fingers ate its bit did she in touching that lone wingrecall the years before her mindbecame a bitter  an abstract thing her thought some popular enmity blind and leader of the blinddrinking the foul ditch where they lie when long ago i saw her rideunder ben bulben to the meet the beauty of her country sidewith all youths lonely wildness stirred she seemed to have grown clean and sweetlike any rock bred  sea borne bird sea borne  or balanced in the airwhen first it sprang out of the nestupon some lofty rock to stareupon the cloudy canopy while under its storm beaten breastcried out the hollows of the sea ,On a Political Prisoner,Modern,Nature
william butler yeats,there was a man whom sorrow named his friend and he  of his high comrade sorrow dreaming went walking with slow steps along the gleamingand humming sands  where windy surges wend and he called loudly to the stars to bendfrom their pale thrones and comfort him  but theyamong themselves laugh on and sing alway and then the man whom sorrow named his friendcried out  dim sea  hear my most piteous story the sea swept on and cried her old cry still rolling along in dreams from hill to hill he fled the persecution of her gloryand  in a far off  gentle valley stopping cried all his story to the dewdrops glistening but naught they heard  for they are always listening the dewdrops  for the sound of their own dropping and then the man whom sorrow named his friendsought once again the shore  and found a shell and thought  i will my heavy story telltill my own words  re echoing  shall sendtheir sadness through a hollow  pearly heart and my own tale again for me shall sing and my own whispering words be comforting and lo  my ancient burden may depart then he sang softly nigh the pearly rim but the sad dweller by the sea ways lonechanged all he sang to inarticulate moanamong her wildering whirls  forgetting him ,The Sad Shepherd,Modern,Nature
william butler yeats,the woods of arcady are dead and over is their antique joy of old the world on dreaming fed grey truth is now her painted toy yet still she turns her restless head but o  sick children of the world of all the many changing thingsin dreary dancing past us whirled to the cracked tune that chronos sings words alone are certain good where are now the warring kings word be mockers by the roodwhere are now the warring kings an idle word is now their glory by the stammering schoolboy said reading some entangled story the kings of the old time are dead the wandering earth herself may beonly a sudden flaming word in clanging space a moment heard troubling the endless reverie then nowise worship dusty deeds nor seek  for this is also sooth to hunger fiercely after truth lest all thy toiling only breedsnew dreams  new dreams  there is no truthsaving in thine own heart  seek  then no learning from the starry men who follow with the optic glassthe whirling ways of stars that passseek  then  for this is also sooth no word of theirsthe cold star banehas cloven and rent their hearts in twain and dead is all their human truth go gather by the humming seasome twisted  echo harbouring shell and to its lips thy story tell and they thy comforters will be rewarding in melodious guilethy fretful words a little while till they shall singing fade in ruthand die a pearly brotherhood for words alone are certain good sing  then  for this is also sooth i must be gone  there is a gravewhere daffodil and lily wave and i would please the hapless faun buried under the sleepy ground with mirthful songs before the dawn his shouting days with mirth were crowned and still i dream he treads the lawn walking ghostly in the dew pierced by my glad singing through my songs of old earths dreamy youth but ah  she dreams not now  dream thou for fair are poppies on the brow dream  dream  for this is also sooth ,The Song of the Happy Shepherd,Modern,Nature
wallace stevens,wallace stevens   the poem that took the place of a mountain  from the collected poems  copyright1954 by wallace stevens reprinted by permission of random house  inc ,The Poem that Took the Place of a Mountain,Modern,Nature
samuel greenberg,by a peninsula the painter sat andsketched the uneven valley groves the apostle gave alms to themeek  the volcano burstin fusive sulphur and hurledrocks and ore into the airheavens sudden change atthe drawing tempestuous darkening shade of dense clouded hues the wanderer soon chosehis spot of rest  they bore thechosen hero upon their shoulders whom they strangely admired  asthe beach tide summer of people desired ,Conduct,Modern,Nature
samuel greenberg,is this the river east i heard where the ferries  tugs and sailboats stirredand the reaching wharves from the inner landourstretched  like the harmless receiving hand and the silvery tinge that sparkles aloudlike the brilliant white demons  which a tide has towedfrom the rays of the morning sunwhich it doth ceaselessly shine upon  but look at the depth of the drippling tidethe dripples  reripples like the locusts astride as the boat turns upon the silvery spreadit leavesstrangea shadow dead  and the very charms from the reflective riverand from the stacks of the floating boatthere seemeth the quality neer to disseverlike the ruffles from the mystified smoke ,East Rivers Charm,Modern,Nature
samuel greenberg,the motion of gathering loops of watermust either burst or remain in a moment the violet colors through the glassthrow up little swellings that appearand spatter as soon as another strikesand is born  so pure are they of coloredhues  that we feel the absent strengthof its power  when they begin they gatherlike sand on the beach  each bubblecontains a complete eye of water ,The Glass Bubbles,Modern,Nature
william butler yeats,i went out to the hazel wood because a fire was in my head and cut and peeled a hazel wand and hooked a berry to a thread and when white moths were on the wing and moth like stars were flickering out i dropped the berry in a streamand caught a little silver trout when i had laid it on the floori went to blow the fire a flame but something rustled on the floor and someone called me by my name it had become a glimmering girlwith apple blossom in her hairwho called me by my name and ranand faded through the brightening air though i am old with wanderingthrough hollow lands and hilly lands i will find out where she has gone and kiss her lips and take her hands and walk among long dappled grass and pluck till time and times are done the silver apples of the moon the golden apples of the sun ,The Song of Wandering Aengus,Modern,Nature
stephen spender,stephen spender  the truly great from collected poems 1928 1953  copyright1955 by stephen spender  reprinted by permission of ed victor ltd ,The Truly Great,Modern,Nature
wallace stevens,barque of phosphoron the palmy beach  move outward into heaven into the alabastersand night blues  foam and cloud are one sultry moon monstersare dissolving  fill your black hullwith white moonlight  there will never be an endto this droning of the surf ,Fabliau of Florida,Modern,Nature
wallace stevens,the trade wind jingles the rings in the nets around the racks by the docks on indian river it is the same jingle of the water among roots under the banks of the palmettoes it is the same jingle of the red bird breasting the orange treesout of the cedars yet there is no spring in florida  neither in boskage perdu  nor on the nunnery beaches ,Indian River,Modern,Nature
wallace stevens,her terrace was the sandand the palms and the twilight  she made of the motions of her wristthe grandiose gesturesof her thought  the rumpling of the plumesof this creature of the eveningcame to be sleights of sailsover the sea  and thus she roamedin the roamings of her fan partaking of the sea and of the evening as they flowed aroundand uttered their subsiding sound ,Infanta Marina,Modern,Nature
wallace stevens,as the immense dew of floridabrings forththe big finned palmand green vine angering for life  as the immense dew of floridabrings forth hymn and hymnfrom the beholder beholding all these green sidesand gold sides of green sides  and blessed mornings meet for the eye of the young alligator and lightning colorsso  in me  come flingingforms  flames  and the flakes of flames ,Nomad Exquisite,Modern,Nature
edith sitwell,from coterie  1919,At the Fair,Modern,Nature
