author,content,poem name,age,type
william shakespeare,from fairest creatures we desire increase that thereby beautys rose might never die but as the riper should by time decease his tender heir might bear his memory but thou  contracted to thine own bright eyes feedst thy lights flame with self substantial fuel making a famine where abundance lies thyself thy foe  to thy sweet self too cruel though that art now the worlds fresh ornamentand only herald to the gaudy spring within thine own bud buriest thy content and  tender churl  makst waste in niggarding  pity the world  or else this glutton be  to eat the worlds due  by the grave and thee ,Sonnet 1: From fairest creatures we desire increase,Renaissance,Nature
william shakespeare,shall i compare thee to a summers day thou art more lovely and more temperate rough winds do shake the darling buds of may and summers lease hath all too short a date sometime too hot the eye of heaven shines and often is his gold complexion dimmd and every fair from fair sometime declines by chance or natures changing course untrimmd but thy eternal summer shall not fade nor lose possession of that fair thou owst nor shall death brag thou wanderst in his shade when in eternal lines to time thou growst  so long as men can breathe or eyes can see  so long lives this  and this gives life to thee ,Sonnet 18: Shall I compare thee to a summers day?,Renaissance,Nature
thomas nashe,spring  the sweet spring  is the years pleasant king then blooms each thing  then maids dance in a ring cold doth not sting  the pretty birds do sing cuckoo  jug jug  pu we  to witta woo the palm and may make country houses gay lambs frisk and play  the shepherds pipe all day and we hear aye birds tune this merry lay cuckoo  jug jug  pu we  to witta woo the fields breathe sweet  the daisies kiss our feet young lovers meet  old wives a sunning sit in every street these tunes our ears do greet cuckoo  jug jug  pu we  to witta woo spring  the sweet spring ,"Spring, the sweet spring",Renaissance,Nature
queen elizabeth i,no crooked leg  no bleared eye no part deformed out of kind nor yet so ugly half can beas is the inward suspicious mind ,Written in her French Psalter,Renaissance,Nature
john donne,twice or thrice had i lovd thee before i knew thy face or name so in a voice  so in a shapeless flameangels affect us oft  and worshippd be  still when  to where thou wert  i came some lovely glorious nothing i did see  but since my soul  whose child love is takes limbs of flesh  and else could nothing do  more subtle than the parent islove must not be  but take a body too  and therefore what thou wert  and who i bid love ask  and nowthat it assume thy body  i allow and fix itself in thy lip  eye  and brow whilst thus to ballast love i thought and so more steadily to have gone with wares which would sink admiration i saw i had loves pinnace overfraught  evry thy hair for love to work uponis much too much  some fitter must be sought  for  nor in nothing  nor in thingsextreme  and scattring bright  can love inhere  then  as an angel  face  and wingsof air  not pure as it  yet pure  doth wear  so thy love may be my loves sphere just such disparityas is twixt air and angels purity twixt womens love  and mens  will ever be ,Air and Angels,Renaissance,Nature
sir philip sidney,with how sad steps  o moon  thou climbst the skies how silently  and with how wan a face what  may it be that even in heavnly placethat busy archer his sharp arrows tries sure  if that long with love acquainted eyescan judge of love  thou feelst a lovers case i read it in thy looks  thy languishd graceto me  that feel the like  thy state descries then  evn of fellowship  o moon  tell me is constant love deemd there but want of wit are beauties there as proud as here they be do they above love to be lovd  and yetthose lovers scorn whom that love doth possess do they call virtue there ungratefulness ,"Astrophil and Stella 31: With how sad steps, O Moon, thou climb'st the skies",Renaissance,Nature
sir philip sidney,when nature made her chief work  stellas eyes in colour black why wrapt she beams so bright would she in beamy black  like painter wise frame daintiest lustre  mixd of shades and light or did she else that sober hue devise in object best to knit and strength our sight lest  if no veil these brave gleams did disguise they  sunlike  should more dazzle than delight or would she her miraculous power show that  whereas black seems beautys contrary she even in black doth make all beauties flow both so  and thus  she  minding love should beplacd ever there  gave him this mourning weedto honour all their deaths who for her bleed ,"Astrophil and Stella 7: When Nature made her chief work, Stella's eyes",Renaissance,Nature
john donne,come live with me  and be my love and we will some new pleasures proveof golden sands  and crystal brooks with silken lines  and silver hooks there will the river whispering runwarmd by thy eyes  more than the sun and there the enamourd fish will stay begging themselves they may betray when thou wilt swim in that live bath each fish  which every channel hath will amorously to thee swim gladder to catch thee  than thou him if thou  to be so seen  best loth by sun or moon  thou darknest both and if myself have leave to see i need not their light having thee let others freeze with angling reeds and cut their legs with shells and weeds or treacherously poor fish beset with strangling snare  or windowy net let coarse bold hands from slimy nestthe bedded fish in banks out wrest or curious traitors  sleeve silk flies bewitch poor fishes wandring eyes for thee  thou needst no such deceit for thou thyself art thine own bait that fish  that is not catchd thereby alas  is wiser far than i ,The Bait,Renaissance,Nature
john donne,our storm is past  and that storms tyrannous rage a stupid calm  but nothing it  doth suage the fable is inverted  and far morea block afflicts  now  than a stork before storms chafe  and soon wear out themselves  or us in calms  heaven laughs to see us languish thus as steadyas i can wish that my thoughts were smooth as thy mistress glass  or what shines there the sea is now  and  as the isles which weseek  when we can move  our ships rooted be as water did in storms  now pitch runs out as lead  when a fird church becomes one spout and all our beauty  and our trim  decays like courts removing  or like ended plays the fighting place now seamens rags supply and all the tackling is a frippery no use of lanthorns  and in one place layfeathers and dust  to day and yesterday earths hollownesses  which the worlds lungs are have no more wind than the upper vault of air we can nor lost friends nor sought foes recover but meteor like  save that we move not  hover only the calenture together drawsdear friends  which meet dead in great fishes jaws and on the hatches  as on altars  lieseach one  his own priest  and own sacrifice who live  that miracle do multiply where walkers in hot ovens do not die if in despite of these we swim  that hathno more refreshing than our brimstone bath but from the sea into the ship we turn like parboild wretches  on the coals to burn like bajazet encagd  the shepherds scoff or like slack sinewd samson  his hair off languish our ships  now as a myriadof ants durst th emperors lovd snake invade the crawling gallies  sea gaols  finny chips might brave our pinnaces  now bed rid ships whether a rotten state  and hope of gain or to disuse me from the queasy painof being belovd and loving  or the thirstof honour  or fair death  out pushd me first i lose my end  for here  as well as i a desperate may live  and a coward die stag  dog  and all which from or towards flies is paid with life or prey  or doing dies fate grudges us all  and doth subtly laya scourge  gainst which we all forget to pray he that at sea prays for more wind  as wellunder the poles may beg cold  heat in hell what are we then  how little more  alas is man now  than before he was  he wasnothing  for us  we are for nothing fit chance  or ourselves  still disproportion it we have no power  no will  no sense  i lie i should not then thus feel this misery ,The Calm,Renaissance,Nature
john donne,where  like a pillow on a bed a pregnant bank swelld up to restthe violets reclining head  sat we two  one anothers best our hands were firmly cemented with a fast balm  which thence did spring our eye beams twisted  and did thread our eyes upon one double string so tointergraft our hands  as yet was all the means to make us one and pictures in our eyes to get was all our propagation as twixt two equal armies fate suspends uncertain victory our souls  which to advance their state were gone out  hung twixt her and me and whilst our souls negotiate there  we like sepulchral statues lay all day  the same our postures were  and we said nothing  all the day if any  so by love refind that he souls language understood and by good love were grown all mind  within convenient distance stood he  though he knew not which soul spake  because both meant  both spake the same might thence a new concoction take and part far purer than he came this ecstasy doth unperplex  we said  and tell us what we love we see by this it was not sex  we see we saw not what did move but as all several souls contain mixture of things  they know not what love these mixd souls doth mix again and makes both one  each this and that a single violet transplant  the strength  the colour  and the size  all which before was poor and scant  redoubles still  and multiplies when love with one another so interinanimates two souls that abler soul  which thence doth flow  defects of loneliness controls we then  who are this new soul  know of what we are composd and made for th atomies of which we grow are souls  whom no change can invade but oh alas  so long  so far  our bodies why do we forbear theyare ours  though theyare not we  we are the intelligences  they the spheres we owe them thanks  because they thus did us  to us  at first convey yielded their senses force to us  nor are dross to us  but allay on man heavens influence works not so  but that it first imprints the air so soul into the soul may flow though it to body first repair as our blood labors to beget spirits  as like souls as it can because such fingers need to knit that subtle knot which makes us man so must pure lovers souls descend t affections  and to faculties which sense may reach and apprehend  else a great prince in prison lies toour bodies turn we then  that so weak men on love reveald may look loves mysteries in souls do grow  but yet the body is his book and if some lover  such as we  have heard this dialogue of one let him still mark us  he shall see small change  when weare to bodies gone ,The Ecstasy,Renaissance,Nature
john donne,no spring nor summer beauty hath such grace as i have seen in one autumnal face young beauties force our love  and thats a rape  this doth but counsel  yet you cannot scape if twere a shame to love  here twere no shame  affection here takes reverences name were her first years the golden age  thats true  but now shes gold oft tried and ever new that was her torrid and inflaming time  this is her tolerable tropic clime fair eyes  who asks more heat than comes from hence  he in a fever wishes pestilence call not these wrinkles  graves  if graves they were  they were loves graves  for else he is no where yet lies not love dead here  but here doth sit vowd to this trench  like an anachorit and here till hers  which must be his death  come  he doth not dig a grave  but build a tomb here dwells he  though he sojourn evrywhere in progress  yet his standing house is here here where still evening is  not noon nor night  where no voluptuousness  yet all delight in all her words  unto all hearers fit  you may at revels  you at council  sit this is loves timber  youth his underwood  there he  as wine in june  enrages blood which then comes seasonabliest when our taste and appetite to other things is past xerxes strange lydian love  the platan tree  was lovd for age  none being so large as she or else because  being young  nature did bless her youth with ages glory  barrenness if we love things long sought  age is a thing which we are fifty years in compassing if transitory things  which soon decay  age must be loveliest at the latest day but name not winter faces  whose skins slack  lank as an unthrifts purse  but a souls sack whose eyes seek light within  for all heres shade  whose mouths are holes  rather worn out than made whose every tooth to a several place is gone  to vex their souls at resurrection name not these living deaths heads unto me  for these  not ancient  but antique be i hate extremes  yet i had rather stay with tombs than cradles  to wear out a day since such loves natural lation is  may still my love descend  and journey down the hill not panting after growing beauties  so  i shall ebb on with them who homeward go ,Elegy IX: The Autumnal,Renaissance,Nature
john donne,here take my picture  though i bid farewellthine  in my heart  where my soul dwells  shall dwell tis like me now  but i dead  twill be morewhen we are shadows both  than twas before when weather beaten i come back  my handperhaps with rude oars torn  or sun beams tannd my face and breast of haircloth  and my headwith cares rash sudden storms being oerspread my bodya sack of bones  broken within and powders blue stains scatterd on my skin if rival fools tax thee tohave lovd a manso foul and coarse as  oh  i may seem then this shall say what i was  and thou shalt say  do his hurts reach me  doth my worth decay or do they reach his judging mind  that heshould now love less  what he did love to see that which in him was fair and delicate was but the milk which in loves childish statedid nurse it  who now is grown strong enoughto feed on that  which to disusd tastes seems tough  ,Elegy V: His Picture,Renaissance,Nature
john donne,thou hast made me  and shall thy work decay repair me now  for now mine end doth haste i run to death  and death meets me as fast and all my pleasures are like yesterday i dare not move my dim eyes any way despair behind  and death before doth castsuch terror  and my feebled flesh doth wasteby sin in it  which it towards hell doth weigh only thou art above  and when towards theeby thy leave i can look  i rise again but our old subtle foe so tempteth me that not one hour i can myself sustain thy grace may wing me to prevent his art and thou like adamant draw mine iron heart ,"Holy Sonnets: Thou hast made me, and shall thy work decay?",Renaissance,Nature
john donne,since i am coming to that holy room  where  with thy choir of saints for evermore i shall be made thy music  as i come i tune the instrument here at the door  and what i must do then  think here before whilst my physicians by their love are grown cosmographers  and i their map  who lieflat on this bed  that by them may be shown that this is my south west discovery per fretum febris  by these straits to die i joy  that in these straits i see my west  for  though their currents yield return to none what shall my west hurt me  as west and east in all flat maps  and i am one  are one  so death doth touch the resurrection is the pacific sea my home  or are the eastern riches  is jerusalem anyan  and magellan  and gibraltar  all straits  and none but straits  are ways to them  whether where japhet dwelt  or cham  or shem we think that paradise and calvary  christs cross  and adams tree  stood in one place look  lord  and find both adams met in me  as the first adams sweat surrounds my face  may the last adams blood my soul embrace so  in his purple wrappd  receive me  lord  by these his thorns  give me his other crown and as to others souls i preachd thy word  be this my text  my sermon to mine own  therefore that he may raise  the lord throws down  ,"Hymn to God, My God, in My Sickness",Renaissance,Nature
sir thomas wyatt,my galley  charged with forgetfulness thorough sharp seas in winter nights doth passtween rock and rock  and eke mine enmy  alas that is my lord  steereth with cruelness and every owre a thought in readiness as though that death were light in such a case an endless wind doth tear the sail apaceof forced sighs and trusty fearfulness a rain of tears  a cloud of dark disdain hath done the weared cords great hinderance wreathed with error and eke with ignorance the stars be hid that led me to this pain drowned is reason that should me comfort and i remain despairing of the port ,"My Galley, Charged with Forgetfulness",Renaissance,Nature
sir thomas wyatt,my mothers maids  when they did sew and spin they sang sometime a song of the field mouse that  for because her livelood was but thin would needs go seek her townish sisters house she thought herself endured too much pain the stormy blasts her cave so sore did sousethat when the furrows swimmed with the rain she must lie cold and wet in sorry plight and worse than that  bare meat there did remainto comfort her when she her house had dight sometime a barley corn  sometime a bean for which she laboured hard both day and nightin harvest time whilst she might go and glean and where store was stroyed with the flood then well away  for she undone was clean then was she fain to take instead of foodsleep  if she might  her hunger to beguile  my sister   quod she   hath a living good and hence from me she dwelleth not a mile in cold and storm she lieth warm and dryin bed of down  the dirt doth not defileher tender foot  she laboureth not as i richly she feedeth and at the richmans cost and for her meat she needs not crave nor cry by sea  by land  of the delicates  the mosther cater seeks  and spareth for no peril she feedeth on boiled bacon meet and roast and hath thereof neither charge nor travail and when she list  the liquor of the grapedoth glad her heart till that her belly swell  and at this journey she maketh but a jape so forth she goeth  trusting of all this wealthwith her sister her part so for to shape that if she might keep herself in health to live a lady while her life doth last and to the door now is she come by stealth and with her foot anon she scrapeth full fast th other for fear durst not well scarce appear of every noise so was the wretch aghast at last she asked softly who was there and in her language  as well as she could  peep   quod the other   sister  i am here   peace   quod the towny mouse   why speakest thou so loud  and by the hand she took her fair and well  welcome   quod she   my sister  by the rood  she feasted her  that joy it was to tellthe fare they had  they drank the wine so clear and as to purpose now and then it fell she cheered her with  how  sister  what cheer  amids this joy befell a sorry chance that  well away  the stranger bought full dearthe fare she had  for  as she look askance under a stool she spied two steaming eyesin a round head with sharp ears  in francewas never mouse so feard  for the unwisehad not i seen such a beast before yet had nature taught her after her guiseto know her foe and dread him evermore the towny mouse fled  she know whither to go th other had no shift  but wonders sorefeard of her life  at home she wished her tho and to the door  alas  as she did skip the heaven it would  lo  and eke her chance was so at the threshold her silly foot did trip and ere she might recover it again the traitor cat had caught her by the hip and made her there against her will remain that had forgotten her poor surety and restfor seeming wealth wherein she thought to reign alas  my poynz  how men do seek the bestand find the worst  by error as they stray and no marvail  when sight is so opprest and blind the guide  anon out of the waygoeth guide and all in seeking quiet life o wretched minds  there is no gold that maygrant that ye seek  no war  no peace  no strife no  no  although thy head were hooped with gold sergeant with mace  hawbert  sword  nor knife cannot repulse the care that follow should each kind of life hath with him his disease live in delight even as thy lust would and thou shalt find  when lust doth most thee please it irketh straight and by itself doth fade a small thing it is that may thy mind appease none of ye all there is that is so madto seek grapes upon brambles or breres nor none  i trow  that hath his wit so badto set his hay for conies over rivers ne ye set not a drag net for an hare and yet the thing that most is your desireye do mis seek with more travail and care make plain thine heart  that it be not knottedwith hope or dread  and see thy will be barefrom all affects  whom vice hath ever spotted thyself content with that is thee assigned and use it well that is to thee allotted then seek no more out of thyself to findthe thing that thou hast sought so long before for thou shalt feel it sitting in thy mind mad  if ye list to continue your sore let present pass and gape on time to come and deep yourself in travail more and more henceforth  my poynz  this shall be all and some these wretched fools shall have nought else of me but to the great god and to his high doom none other pain pray i for them to be but when the rage doth lead them from the right that  looking backward  virtue they may see even as she is  so goodly fair and bright and whilst they clasp their lusts in arms across grant them  good lord  as thou mayst of thy mightto fret inward for losing such a loss ,Of the Mean and Sure Estate,Renaissance,Nature
john donne,forget this rotten world  and unto theelet thine own times as an old story be be not concernd  study not why  nor when do not so much as not believe a man for though to err  be worst  to try truths forthis far more business than this world is worth ihe world is but a carcass  thou art fedby it  but as a worm  that carcass bred and why shouldst thou  poor worm  consider more when this world will grow better than before than those thy fellow worms do think uponthat carcasss last resurrection forget this world  and scarce think of it so as of old clothes  cast off a year ago to be thus stupid is alacrity men thus lethargic have best memory look upward  thats towards her  whose happy statewe now lament not  but congratulate she  to whom all this world was but a stage where all sat hearkning how her youthful ageshould be employd  because in all she didsome figure of the golden times was hid who could not lack  whater this world could give because she was the form  that made it live nor could complain that this world was unfitto be stayd in  then when she was in it she  that first tried indifferent desiresby virtue  and virtue by religious fires she  to whose person paradise adherd as courts to princes  she  whose eyes enspherdstar light enough t have made the south control  had she been there  the star full northern pole she  she is gone  she is gone  when thou knowest this what fragmentary rubbish this world isthou knowest  and that it is not worth a thought he honours it too much that thinks it nought think then  my soul  that death is but a groom which brings a taper to the outward room whence thou spiest first a little glimmering light and after brings it nearer to thy sight for such approaches doth heaven make in death think thyself labouring now with broken breath and think those broken and soft notes to bedivision  and thy happiest harmony think thee laid on thy death bed  loose and slack and think that but unbinding of a pack to take one precious thing  thy soul  from thence think thyself parchd with fevers violence anger thine ague more  by calling itthy physic  chide the slackness of the fit think that thou hearst thy knell  and think no more but that  as bells calld thee to church before so this to the triumphant church calls thee think satans sergeants round about thee be and think that but for legacies they thrust give one thy pride  toanother give thy lust give them those sins which they gave thee before and trust th immaculate blood to wash thy score think thy friends weeping round  and think that theyweep but because they go not yet thy way think that they close thine eyes  and think in this that they confess much in the world amiss who dare not trust a dead mans eye with thatwhich they from god and angels cover not think that they shroud thee up  and think from thencethey reinvest thee in white innocence think that thy body rots  and  if so low thy soul exalted so  thy thoughts can go think thee a prince  who of themselves createworms  which insensibly devour their state think that they bury thee  and think that ritelays thee to sleep but a saint lucys night ,Of the Progress of the Soul: The Second Anniversary,Renaissance,Nature
christopher marlowe,come live with me and be my love and we will all the pleasures prove that valleys  groves  hills  and fields woods  or steepy mountain yields and we will sit upon the rocks seeing the shepherds feed their flocks by shallow rivers to whose fallsmelodious birds sing madrigals and i will make thee beds of rosesand a thousand fragrant posies a cap of flowers  and a kirtleembroidered all with leaves of myrtle a gown made of the finest woolwhich from our pretty lambs we pull fair lined slippers for the cold with buckles of the purest gold a belt of straw and ivy buds with coral clasps and amber studs and if these pleasures may thee move come live with me  and be my love the shepherds swains shall dance and singfor thy delight each may morning if these delights thy mind may move then live with me  and be my love ,The Passionate Shepherd to His Love,Renaissance,Nature
william shakespeare,full fathom five thy father lies of his bones are coral made those are pearls that were his eyes nothing of him that doth fade but doth suffer a sea changeinto something rich and strange sea nymphs hourly ring his knell  ding dong hark  now i hear them ding dong  bell ,Song: Full fathom five thy father lies ,Renaissance,Nature
